[
  {
    "id": "feature.empty",
    "numericId": 0,
    "packId": "base",
    "weight": 18,
    "mesh": null,
    "tags": ["empty", "safe"],
    "allowedTerrainTags": ["walkable"],
    "forbiddenWithinMetersOf": {},
    "minDistanceFromOrigin": 0,
    "maxSlopeDegrees": 38,
    "blocksMovement": false,
    "lethal": false
  },
  {
    "id": "feature.flowers",
    "numericId": 1,
    "packId": "base",
    "weight": 7,
    "mesh": "/assets/proxies/base/flowers.proxy.json",
    "tags": ["flowers", "detail", "safe"],
    "allowedTerrainTags": ["meadow", "wild_grass"],
    "forbiddenWithinMetersOf": { "origin": 1 },
    "minDistanceFromOrigin": 2.5,
    "maxSlopeDegrees": 30,
    "blocksMovement": false,
    "lethal": false,
    "neighborBias": { "flowers": 1.4, "meadow": 1.15 }
  },
  {
    "id": "feature.small-rock",
    "numericId": 2,
    "packId": "base",
    "weight": 5,
    "mesh": "/assets/proxies/base/small-rock.proxy.json",
    "tags": ["rock", "detail", "safe"],
    "allowedTerrainTags": ["walkable", "stone", "dry"],
    "forbiddenWithinMetersOf": { "origin": 1.5 },
    "minDistanceFromOrigin": 2.5,
    "maxSlopeDegrees": 38,
    "blocksMovement": false,
    "lethal": false
  },
  {
    "id": "feature.shrub",
    "numericId": 3,
    "packId": "base",
    "weight": 5,
    "mesh": "/assets/proxies/base/shrub.proxy.json",
    "tags": ["shrub", "vegetation", "safe"],
    "allowedTerrainTags": ["meadow", "wild_grass", "dry"],
    "forbiddenWithinMetersOf": { "origin": 2.5, "corridor": 1 },
    "minDistanceFromOrigin": 3,
    "maxSlopeDegrees": 32,
    "blocksMovement": false,
    "lethal": false
  },
  {
    "id": "feature.origin-monolith",
    "numericId": 4,
    "packId": "base",
    "weight": 0.1,
    "mesh": "/assets/proxies/base/origin-monolith.proxy.json",
    "tags": ["origin", "monolith", "respawn", "safe"],
    "allowedTerrainTags": ["meadow", "open", "walkable"],
    "forbiddenWithinMetersOf": { "origin": 0 },
    "minDistanceFromOrigin": 0,
    "maxSlopeDegrees": 0,
    "blocksMovement": true,
    "lethal": false,
    "uniquePerChunk": true
  },
  {
    "id": "feature.water.reeds",
    "numericId": 5,
    "packId": "water",
    "weight": 8,
    "mesh": "/assets/proxies/water/reeds.proxy.json",
    "tags": ["reeds", "water", "vegetation"],
    "allowedTerrainTags": ["shallow_water", "shore", "marsh"],
    "forbiddenWithinMetersOf": { "origin": 4, "corridor": 0.8 },
    "minDistanceFromOrigin": 8,
    "maxSlopeDegrees": 20,
    "blocksMovement": false,
    "lethal": false,
    "neighborBias": { "reeds": 1.6, "marsh": 1.4 }
  },
  {
    "id": "feature.water.lilies",
    "numericId": 6,
    "packId": "water",
    "weight": 5,
    "mesh": "/assets/proxies/water/lilies.proxy.json",
    "tags": ["lilies", "water", "detail"],
    "allowedTerrainTags": ["water", "shallow_water"],
    "forbiddenWithinMetersOf": { "origin": 4 },
    "minDistanceFromOrigin": 8,
    "maxSlopeDegrees": 5,
    "blocksMovement": false,
    "lethal": false,
    "neighborBias": { "lilies": 1.25, "shallow_water": 1.3 }
  },
  {
    "id": "feature.water.spring",
    "numericId": 7,
    "packId": "water",
    "weight": 1,
    "mesh": "/assets/proxies/water/spring.proxy.json",
    "tags": ["spring", "water", "seed_anchor"],
    "allowedTerrainTags": ["shore", "marsh", "walkable"],
    "forbiddenWithinMetersOf": { "origin": 8, "corridor": 0 },
    "minDistanceFromOrigin": 10,
    "maxSlopeDegrees": 15,
    "blocksMovement": false,
    "lethal": false,
    "uniquePerChunk": true
  },
  {
    "id": "feature.forest.young-tree",
    "numericId": 8,
    "packId": "forest",
    "weight": 7,
    "mesh": "/assets/proxies/forest/young-tree.proxy.json",
    "tags": ["forest", "tree", "young", "vertical"],
    "allowedTerrainTags": ["forest", "moss", "root_ground"],
    "forbiddenWithinMetersOf": {
      "origin": 8,
      "corridor": 2.5,
      "seed_anchor": 2
    },
    "minDistanceFromOrigin": 18,
    "maxSlopeDegrees": 30,
    "blocksMovement": true,
    "lethal": false,
    "neighborBias": { "tree": 1.45, "forest": 1.35 }
  },
  {
    "id": "feature.forest.old-tree",
    "numericId": 9,
    "packId": "forest",
    "weight": 4,
    "mesh": "/assets/proxies/forest/old-tree.proxy.json",
    "tags": ["forest", "tree", "old", "vertical"],
    "allowedTerrainTags": ["forest", "moss", "root_ground"],
    "forbiddenWithinMetersOf": {
      "origin": 10,
      "corridor": 3,
      "seed_anchor": 2
    },
    "minDistanceFromOrigin": 20,
    "maxSlopeDegrees": 28,
    "blocksMovement": true,
    "lethal": false,
    "neighborBias": { "tree": 1.65, "forest": 1.45 }
  },
  {
    "id": "feature.forest.fallen-trunk",
    "numericId": 10,
    "packId": "forest",
    "weight": 4,
    "mesh": "/assets/proxies/forest/fallen-trunk.proxy.json",
    "tags": ["forest", "trunk", "fallen"],
    "allowedTerrainTags": ["forest", "moss", "root_ground"],
    "forbiddenWithinMetersOf": {
      "origin": 8,
      "corridor": 2.5,
      "seed_anchor": 2
    },
    "minDistanceFromOrigin": 18,
    "maxSlopeDegrees": 24,
    "blocksMovement": true,
    "lethal": false,
    "neighborBias": { "tree": 1.25, "moss": 1.25 }
  },
  {
    "id": "feature.forest.mushrooms",
    "numericId": 11,
    "packId": "forest",
    "weight": 6,
    "mesh": "/assets/proxies/forest/mushrooms.proxy.json",
    "tags": ["forest", "mushrooms", "detail"],
    "allowedTerrainTags": ["forest", "moss", "root_ground"],
    "forbiddenWithinMetersOf": { "origin": 6 },
    "minDistanceFromOrigin": 16,
    "maxSlopeDegrees": 32,
    "blocksMovement": false,
    "lethal": false,
    "neighborBias": { "mushrooms": 1.45, "old": 1.15 }
  },
  {
    "id": "feature.ruin.arch",
    "numericId": 12,
    "packId": "ruin",
    "weight": 3,
    "mesh": "/assets/proxies/ruin/arch.proxy.json",
    "tags": ["ruin", "arch", "monument", "vertical"],
    "allowedTerrainTags": ["ruin_floor", "structural_support"],
    "forbiddenWithinMetersOf": {
      "origin": 20,
      "corridor": 3,
      "seed_anchor": 2.5
    },
    "minDistanceFromOrigin": 30,
    "maxSlopeDegrees": 8,
    "blocksMovement": true,
    "lethal": false,
    "neighborBias": { "ruin": 1.7, "column": 1.2 }
  },
  {
    "id": "feature.ruin.column",
    "numericId": 13,
    "packId": "ruin",
    "weight": 5,
    "mesh": "/assets/proxies/ruin/column.proxy.json",
    "tags": ["ruin", "column", "structural", "vertical"],
    "allowedTerrainTags": ["ruin_floor", "structural_support"],
    "forbiddenWithinMetersOf": {
      "origin": 20,
      "corridor": 2.5,
      "seed_anchor": 2
    },
    "minDistanceFromOrigin": 28,
    "maxSlopeDegrees": 8,
    "blocksMovement": true,
    "lethal": false,
    "neighborBias": { "column": 1.5, "ruin": 1.4 }
  },
  {
    "id": "feature.ruin.wall-fragment",
    "numericId": 14,
    "packId": "ruin",
    "weight": 5,
    "mesh": "/assets/proxies/ruin/wall-fragment.proxy.json",
    "tags": ["ruin", "wall", "structural"],
    "allowedTerrainTags": ["ruin_floor", "structural_support"],
    "forbiddenWithinMetersOf": {
      "origin": 20,
      "corridor": 3,
      "seed_anchor": 2
    },
    "minDistanceFromOrigin": 28,
    "maxSlopeDegrees": 8,
    "blocksMovement": true,
    "lethal": false,
    "neighborBias": { "wall": 1.5, "ruin": 1.35 }
  },
  {
    "id": "feature.ruin.statue",
    "numericId": 15,
    "packId": "ruin",
    "weight": 2,
    "mesh": "/assets/proxies/ruin/statue.proxy.json",
    "tags": ["ruin", "statue", "monument", "unique"],
    "allowedTerrainTags": ["ruin_floor", "structural_support"],
    "forbiddenWithinMetersOf": {
      "origin": 24,
      "corridor": 2.5,
      "seed_anchor": 2
    },
    "minDistanceFromOrigin": 32,
    "maxSlopeDegrees": 6,
    "blocksMovement": true,
    "lethal": false,
    "uniquePerChunk": true,
    "neighborBias": { "ruin": 1.6, "column": 1.2 }
  },
  {
    "id": "feature.storm.crystal",
    "numericId": 16,
    "packId": "storm",
    "weight": 4,
    "mesh": "/assets/proxies/storm/crystal.proxy.json",
    "tags": ["storm", "crystal", "hazard", "outer"],
    "allowedTerrainTags": ["storm", "charged_soil", "glass_ground"],
    "forbiddenWithinMetersOf": {
      "origin": 38,
      "corridor": 2.5,
      "seed_anchor": 2
    },
    "minDistanceFromOrigin": 38,
    "maxSlopeDegrees": 20,
    "blocksMovement": true,
    "lethal": true,
    "neighborBias": { "storm": 1.4, "crystal": 1.35 }
  },
  {
    "id": "feature.storm.spikes",
    "numericId": 17,
    "packId": "storm",
    "weight": 3,
    "mesh": "/assets/proxies/storm/spikes.proxy.json",
    "tags": ["storm", "spikes", "hazard", "outer"],
    "allowedTerrainTags": ["storm", "charged_soil", "glass_ground"],
    "forbiddenWithinMetersOf": {
      "origin": 38,
      "corridor": 2.5,
      "seed_anchor": 2
    },
    "minDistanceFromOrigin": 38,
    "maxSlopeDegrees": 25,
    "blocksMovement": false,
    "lethal": true,
    "neighborBias": { "storm": 1.3, "spikes": 1.2 }
  },
  {
    "id": "feature.storm.uncertainty-nest",
    "numericId": 18,
    "packId": "storm",
    "weight": 1.5,
    "mesh": "/assets/proxies/storm/uncertainty-nest.proxy.json",
    "tags": ["storm", "uncertainty", "nest", "outer"],
    "allowedTerrainTags": [
      "storm",
      "charged_soil",
      "glass_ground",
      "scorched_meadow"
    ],
    "forbiddenWithinMetersOf": {
      "origin": 40,
      "corridor": 3,
      "seed_anchor": 3
    },
    "minDistanceFromOrigin": 40,
    "maxSlopeDegrees": 18,
    "blocksMovement": true,
    "lethal": false,
    "uniquePerChunk": true,
    "neighborBias": { "storm": 1.5, "uncertainty": 1.25 }
  },
  {
    "id": "feature.storm.bell-flower",
    "numericId": 19,
    "packId": "storm",
    "weight": 5,
    "mesh": "/assets/proxies/storm/bell-flower.proxy.json",
    "tags": ["storm", "echo_garden", "bell_flower", "detail"],
    "allowedTerrainTags": ["echo_garden", "echo_moss"],
    "forbiddenWithinMetersOf": { "origin": 36, "corridor": 1 },
    "minDistanceFromOrigin": 38,
    "maxSlopeDegrees": 30,